name,catch_copy,lead,description,works_url,movie_url,system_diagram_url
万能掲示板,解決を手に、一人暮らしの困りごとを共有しよう,一人暮らしの困りごとを解決するための便利なプラットフォーム。手に負えない時や高額な業者に頼む前に、信頼できるユーザーが助けに来ます。,"「一人暮らしをサポートする新しいソリューションが登場！」

私たちは、一人暮らしをしている方々のさまざまな課題を解決するために、画期的なITソリューションを提供しています。友達や身近な人の助けがない時や、どうしても自分ひとりでは難しいことがある時に頼れる存在となることを目指しています。

当サービスでは、ユーザーが抱える問題や依頼事項を値段を設定して掲載し、対応できる人材がそれに応じて依頼を受ける仕組みを構築しています。一人暮らしの方々は、掲載されている依頼内容を閲覧し、必要なサービスを選択することができます。依頼が解決された際には、双方合意のもと報酬を支払うことができます。

私たちのサービスの強みは、一人暮らしの方々が抱える問題にスムーズかつ迅速に対応できる点です。また、コスト面でも業者に依頼するよりも手頃な価格で解決策を提供することができます。

一人暮らしをしている方々にとって、私たちのソリューションは頼もしいパートナーとなることでしょう。ぜひ、私たちのブースへお越しください。一人暮らしをもっと快適に、安心して過ごせる新しいサービスをご紹介いたします！",,,
Fresh Deli (フレッシュ デリー),罪悪感を感じずに、ヘルシーなデザートをあなたへ,不安を無くすショッピング体験を目標にしたECサイトで、日本全国のデザート専門店から取り扱っている様々な低カロリーのデザートを提供できます。,Fresh Deliは日本全国のデザート専門店から健康的なデザートを取り扱っているECサイトです。不安や罪悪感を無くして、安心で楽しくショッピング体験を目標にしています。ダイエット中の方、アレルギーを持っている方、デザートが好きでもっと楽しみたい方をターゲットとして健康的なデザートの魅力を伝え、様々な種類や期間限定の商品などを販売しています。当サイトはヘルシーなデザートを販売しているだけではなく、健康のサポートとしてダイエット計画システムという機能があります。お客さんが簡単に目標を立て、その目標を達成したら無料で好きなデザートを一個選べます。好きなデザートを安く手軽に購入できるタイムセールというイベントもあります。,,,
私の！ぐんぐん日記,敬遠、断念せずに菜園を楽しもう,"菜園に対してしてみたいという意欲的な声もあるが様々な問題から断念してしまう人も多い。
その問題をこちらで解決、楽しみながら菜園をしてもらう作品を制作しました。","菜園を続けてもらえるよう、続けてもらうための機能3つに力に入れました。
1つ目の水やりと日記は、それぞれをした後にアドバイスや同じものを作っている人の表示をします。育てきると種が送られてきます。2つ目のお出かけは、様々な人と交流することが出来ます。3つ目のキャンペーンは、定期的に開催し、いくつかの賞と景品があります。
繰り返してもらうかたちとしては、
野菜を育てる→キャンペーンに応募、日記を書いたり投稿したりする→賞をとってみたい、誰か見てくれていないかな？プレゼントがほしい！→種や景品が送られてくる→また育ててみたい
という流れをイメージしています。
ターゲットは菜園をしたくてもできない人、続かない人、初心者の人です。",,,
Tree House Coffee,自由な大自然で、自分だけの特別な一杯を楽しもう,大自然に囲まれた開放的な環境で、心地よい風や鳥のさえずりを聞きながら、自分自身でゆっくりとコーヒーを淹れる贅沢な体験ができます。,当店は、キャンプ場に設けられた特別なコーヒーショップです。自然に囲まれた開放的な環境で、心地よい風や鳥のさえずりを聞きながら、自分自身でコーヒーを淹れる贅沢な体験ができます。コーヒー豆は、世界各地から厳選した高品質な豆を用意しています。お客様は自分の好みに合わせて、豆を選び、挽き方や抽出方法を選んでコーヒーを淹れることができます。専用の淹れ方ガイドやスタッフのアドバイスを受けながら、自分だけのオリジナルなコーヒーを作り上げましょう。「自由な大自然で、自分だけの特別な一杯を楽しもう」というコンセプトのもと、当店ではお客様に自由な発想と創造力を刺激するコーヒー体験を提供しています。あなたのキャンプ場での思い出に、特別なコーヒーモーメントを加えましょう。,,,
肉球,個室で１人でも行きやすい！,"当店舗では一人で行きたいけど人の目が気になって
行けない人や、もっと近くで猫と触れ合いたい人な
どの人におすすめです！！
","
個室の猫カフェは、一部の猫カフェで提供されている特別なスタイルのサービスです。 通常の猫カフェでは、複数の人が猫たちと一緒に過ごせることができますが、個室の猫カフェでは、専用の個室で猫たちとプライベートな時間を過ごすことができます。
さらに個室の猫カフェでは、Wi-Fiや電源などの基本的な設備が整っていますので、仕事をするために必要な環境を提供してくれるのでリラックスした環境で集中力を高めることができます。
アレルギーで行きたいのに行けない人にはリモートでの視聴が可能です！
ただし、個室の猫カフェでの仕事にはいくつかの注意点があります。 まず、猫たちの生き物であり、突然の行動や予測不可能な行動をすることが起こります。中でも、猫たちに気を配る必要があるかもしれません。
また、個室の猫カフェは一般的に時間制限がある場合があるので、事前に予約をすることが必要です。 また、慌てている場合には利用できないこともあるため、事前に確認すること重要です。
個室の猫カフェとリモート両方でねこちゃんたちと戯れましょう！！！！",,,
cookbuddy,キャラクターと一緒に食生活を改善！節約も叶う、料理アプリ,食生活が偏ってしまう、節約がしたいでも料理ができない、という人に向けて、キャラクターを育成しながら料理を学べて、改善も節約もできる料理アプリ。,"このアプリはキャラクターとヘルスがリンクしており、料理をすればその料理の栄養バランスがヘルスに反映されます。食事が偏ったり食事を取らなかったらキャラクターの具合も悪くなり、自分の食生活が目に見えてわかるため、食生活改善の意欲が向上します。その他に、キャラクターのことが知れる漫画やアイテムを料理報酬につけ、愛着が湧くようにすることでさらにキャラクターを大切にしてもらい自分の健康状態の維持に繋げます。
繰り返しを促す機能は、キャラクターの健康状態と季節の旬の料理を通知で定期的に発信することで促します。
このアプリは他のサービスと比べてゲーム感覚で楽しく料理ができるのがウリです。",,,
レトロゲームカフェ,レトロゲームがたくさんがあって遊びまくれるカフェ,"レトロゲームカフェでいろんな人に遊んでもらって楽しむカフェです。
みんなで遊んでコミュニケーションを楽しめる空間です。","レトロゲームカフェでは、たくさん機械があって、ファミコン、スーパーファミコン、セガメガドライブ、ニンテンドー64など、多くのホームゲーム機が揃っており、各機種ごとに様々なゲームをプレイすることができます。昔懐かしいタイトルから隠れた名作まで、幅広い選択肢があります。
レトロゲーム個室を利用すれば、他のお客様との干渉を気にせず、自分たちだけの楽しい時間を過ごすことができます。ぜひ、当店のレトロゲーム個室を利用して、懐かしいゲームの世界に浸りながら、思い出に残る体験をしてください。",,,
Monstera (Coffee&Drinks),自然からの無限のクリエイティブなインスピレーション,Monstera - ヘルシーな飲み物や美味しいケーキをたべながら自然に浸ることができて、勉強や仕事をするのに理想的なスペース,"勉強、仕事、創作のための緑のスペースが必要ですか? 何時間も勉強したり、一生懸命働いた後に友達と集まるのに理想的な場所が必要ですか? モンステラに来て、ヘルシーなドリンクとおいしいケーキを飲みながら自然に浸り、ストレスと疲労を和らげてください。

一般のお客様向けに、心の奥底から創造性を刺激する、新鮮な雰囲気の緑地空間を自信を持ってご提供いたします。 モンステラでは、それをお手伝いするためのさまざまなスペースをご用意しています。ペンやホワイトボードなどのツールの貸し出しも行っており、小さなことからでも便利にご利用いただけます。",,,
ねこ探偵局,猫好き大集合！猫の魅力を大捜索！ねこ探偵局,関西を中心に猫カフェ・野良猫スポットを探索し、ブログやSNSで発信する【猫好きの猫好きによる猫好きのためのメディア】です。,"私たちのメディアは猫の魅力を皆さんにお伝えするべく、ブログ・Instagram・Twitter・TikTokで猫に関する情報を発信しています！1年間でSNS総フォロワー数3500人以上を目標に投稿を頑張っています。
実際に保護猫カフェや野良猫スポットに訪れて発信することで猫好きの方のお出かけの参考や癒しになれるようなメディアを目指しています。
情報発信だけでなく、ねこ探偵局のイメージキャラクター「しゃしゃき」をモチーフにしたグッズの販売や店頭に置いていただけるような、ポスターやステッカーの作成にも力を入れて取り組んでいます。
猫が好きな方は限定のステッカーをお配りしているので是非当ブースへ足を運んでみてください！",,,
New Type,ニュースに鮮度を、タイピングに精度を。,"タイピングの問題はニュースで登場するキーワード。
60秒以内にできるだけたくさんの問題を解答し、ランキング機能で
他プレイヤーとスコアを競い合おう！","ターゲット：タイピング能力の低い20代の新社会人

ジャンル：タイピングゲーム


問題としてその日のニュースキーワードが出題されます。これによりタイピングの練習とニュースの吸収を同時にこなすことが可能です。

各レベルごとにキーワードの長さが違う3つのレベルを用意しており自分に合った難易度に挑戦することができます。

力を入れた部分は、データベースに保存するためのニュースを制限する作業です。

基本的にニュースのタイトルは長いものが多いため、ひらがな化やNewsAPIから取得し、spliceを用いた正規表現によって文字の長さを変えるというフローを考える点で苦労しました。",,,
AniSup,日本のアニメ産業を支えよう！あなたの支援が未来に繋がる,アニメーターがいなければアニメも生まれない。ユーザーに寄り添ったUIでアニメーターの欲しい物を購入したり、会社を直接支援しよう。,このサイトは日本のアニメ業界を支援したいという気持ちで作っています。現在日本のアニメ産業は素晴らしいものとなっていますがアニメを作るアニメーターの労働環境や賃金などが問題になっています。そこで我々視聴者が直接支援して日本のアニメ産業を支えようと思い、制作に至りました。基本的な機能として支援を希望するアニメーターにはほしい物リストの提示や銀行振り込みで金銭的な支援を受け取る事ができるようになっています。また、コメント機能も実装しておりアニメーターに直接応援のコメントを送れるようになっています。,,,
 JOHN SMITH CAFE,言語で無限の可能性を見つけよう。,"言語は人の可能性を発見する武器である。このカフェでは外国人と日本人と交流できる場所です。英語・日本語使い、世界を知り、新たな縁を作ろう。
","このカフェでは「ROUNDTABLE」というイベントがあり、日本人と外国人が会え、交流でき、新しい縁を作れるという特徴がある。イベントの目標は外国人と日本人は英語・日本語が学べる。また国際・国内の友達も作れる。話すテーマは店からはもう準備したが他のこと話しても大丈夫。このイベントターゲットは英語が全くできない人も大丈夫.

このサイトを作る時、意識したことは分かりやすさである。誰に向けるやイベントの流れについてがサイトを見た瞬間分かるように作りました。例えば外国人のターゲットもいるので分かりやすいため、英語の説明や分かりやすい画像を追加しました。",,,
ひややっ庫,冷蔵庫の食べ物捨ててない？ 冷蔵庫の中身を写真で管理するスマホアプリ,"冷蔵庫の中身を管理しきれず必要以上に食材を買ってしまい
廃棄してしまう。もったいないですよね。
このアプリを使えば冷蔵庫の食材を残さず消費できます！","あなたは日本のフードロス問題を知っていますか？今日本では年間523万トン、
毎日10tトラック約1,433台分の食品を廃棄しています。そのうち家庭からは約半分もの食品が賞味期限切れや、食べ残しなどで捨てられているのです。
そこで私たちは、家にあるのに買ってしまう、
いつの間にか消費期限が切れて捨ててしまうなどで困っている方のために家庭の食品ロスをすくなするためのアプリ「ひややっ庫」というアプリを作りました。
このアプリを使うことでそのような問題とはおさらばです！！また食品ロスを減らせれば余計な出費を減らすことができます！！
使い方は簡単で買ってきた商品の写真を撮り、消費・賞味期限を入力するだけ！！",,,
スマーホレジ,スムーズな会計で、安価に人手不足と待機時間の解消を・・・,スーパーなどで、お客様のスマホで商品を登録し、キャッシュレスならそのままお支払い。商品をレジに通す必要がないため、スムーズな取引ができます,"この作品は、混雑のしやすいスーパーやコンビニなどの小売店、または少量の買い物をする消費者て制作しました。

最近流行りのセルフレジは導入費用が高く、人によっては時間がかかります。
なので、消費者を手に取った時点で商品を登録してもらうことで、商品をレジで通す手間を短縮、キャッシュレスでお支払いするのであれば、スマホ1つで完結することも可能です。
そして、小売店の導入コストも、規模に合わせたサービス利用料のみ、そして既存のシステムと共存できるよう考えています。",,,
熱中症対策アプリ,命を見守り、導く,ユーザーの現在地を取得して、熱中症リスクを算出してお知らせします！熱中症は気づかないうちになっているものだからこそ、数値という客観的なデータをもとにしてリアルタイムでリスクを計算して通知することで、ユーザーの健康と安全をサポートします！,　本作はアンドロイドアプリで、常に身に着けているスマホ向けに制作したことで、ユーザーがどこにいてもリアルタイムでその健康と安全をサポートすることができます。ターゲットとなるのはかなり広い客層ですが、主に炎天下での作業が求められるブルーカラー労働者の方々が使用されることを強く意識しております。リアルタイムで現在地を取得し、APIをもとにして外気温を取得、熱中症リスクを計算して通知し、リスクが致命的になれば、自動的に現在地近くの病院を検索して表示することで、危険が迫った時にすぐに救命が行えるように手はずを整えました。,,,
Akind,いらない服を再利用！？,"着なくなった服を貸し出したり、出品することで服を再利用しよう！
","ターゲット：20代～30代の女性（若め）
システム：使わなくなった服を個人や、店舗で出品できるフリマアプリ
機能：出品、検索、商品管理",,,
タンポポベーカリー,日々、愛される手作りパン,みなさまに、愛されるようなパンを食べていただきたい。そんな思いで作り続けて、創業から２０年を迎えました。,"タンポポベーカリーの、サイトの目的は、パンの焼き時間を掲載して、お客様が求めているパンを売っている時間に来店しやすくする。
50歳の夫婦の経営になると、お客様の変化しやすい対応、例えばお客様都合になるような、オーダーメイドなどの余裕がなくなるのを避けることができるようになると考えました。

そして、20年にわたり、地域の繋がりが深いことで、地元の子ども食堂との連携が取りやすいと思い、寄付金でチケットに変換して、寄付を受ける側に無料のパンを提供する代わりに、
寄付を利用する側は手紙を一言だけでも書くという、寄付をする側と気持ちを交換することで、
寄付をする側には、実感とお金が目的通り使われたことと、受ける側は手紙を一言書くことで、受け取れると食に関して豊かに慣れると思います。",,,
ZUNNET,最小の時間で最大の効果を,授業の課題やアルバイトで忙しいECCコンピュータ専門学校の学生に、最小の時間で最大の効果をもたらす学習の補助ができる作品にするため本キャッチコピーを考えました。,ゲーム形式でネットワーク用語の意味を理解して頂くための学習ツールです。ゲームジャンルは2DでRPGとノベルの融合ゲームです。ターゲットはネットワーク演習を学習する、CCNA受験するECCコンピュータ専門学校の学生です。,,,
勝手に家計簿,これさえ使えば簡単に家計簿がつけれます！,レシート情報があるQRコードを読み込めばレシートを簡単に管理でき、自動で家計簿をつけてくれる、たくさん人の味方になるアプリです。,"このアプリは若い人からお年寄りまでにむけたアプリです。このアプリはカメラでQRコードを読み込むだけで簡単にレシートを管理でき、自動で家計簿につけてくれます。
内部データベースを作ることによって個人それぞれで別の家計簿が作れます。
このアプリが広まることによってレシート削減にもつながりSDGsにも貢献できます。利益などの点に関したら例をいうと一店舗でレシートが0になると年に約10万円程度浮きます。このアプリのために必要なQRコードを提供します。レシート代が浮くので1割程度もらいます。それだけでもたくさんの利益が出ます。",,,
pilgerfahrt,フィクションを超えて、リアルに。あなたの好きな物語の世界へ一歩踏み入れてみませんか？,作品の舞台を実際に体験し、物語に深く浸かる。この一歩が、あなたのファン生活を新たな次元へ導きます。,"アニメやドラマの聖地巡礼アプリは、物語の舞台となるリアルな場所を巡るための究極のガイドです。あなたが愛する作品の世界をより深く理解し、感じるために、我々は物語の背景となる場所を詳しく紹介します。

このアプリは、アニメやドラマのファン、旅行愛好家、そして物語と現実の間を行き来したい全ての人々に向けて開発されました。作品に関連する地域の詳細な情報、訪れるべきスポット、そこでのエピソードなどを手軽に提供します。

私たちのウリは、リッチなコンテンツと直感的なユーザーインターフェースです。あなたが探している情報をすぐに見つけることができ、一方で新しい発見も期待できます。また、我々は地元のコミュニティとも密接に連携して、より生き生きとした体験を提供します。

このアプリであなたのファン生活を一歩先へ進めてみませんか？物語の世界と現実が交差する場所で、新しい発見と感動を待っています。",,,
pilgerfahrt,フィクションを超えて物語の世界へ一歩踏み入れてみませんか,作品の舞台を実際に体験し、物語に深く浸かる。この一歩が、あなたのファン生活を新たな次元へ導きます。最高の聖地巡礼を体験しましょう。,pilgerfahrtは、あなたの愛するアニメやドラマの物語を実地に探索するための最高のガイド。物語の背景にある現実の場所を深く理解し、感じる旅へと導きます。ファン、旅行好き、物語と現実を行き来したい全ての人々へ、詳細な地域情報や訪問スポット、エピソードを提供します。私たちの特長は豊かなコンテンツと直感的なインターフェース。必要な情報は手元にすぐ、新たな発見も待っています。地元コミュニティと連携し、鮮やかな体験を提供します。,,,
S-D2,病院に行くべきか悩む気になる皮膚病を簡単診断,"皮膚が若干荒れて気になっているが、病院に行く時間が無かったり
そもそも行くのが面倒だと思ったときに気軽に簡単に皮膚病の診断を行えます。","肌に悩む方に登録不要で簡単に皮膚診断が行えるWebサイトです。
AIでの画像診断を用いて肌画像から、診断し結果を表示します。
結果をもとに可能性のある皮膚病を上位３つ表示します。
AIを活用することで素早く診断が行え、検証データが多いほどより正確に診断ができます。
病院に行くべきかどうかを迷われている人へ判断材料を増やし、判断をしやすくします。
市販薬でのケアを望まれる人向けにそれぞれの皮膚病に効く市販薬を検索できます。",,,
Breet,あなたがいない家でペットがどうしてるか知っていますか？,"Breetは、ペットを飼っていて外出が多い人に向けたアプリです。
外出先からスマホ1つでペットの健康状態が確認でき、空調管理や餌やりをスマホから行えます。","チームCはWoTで社会問題の解決をしたいという目標に向けて制作に取り組みました。
私達が取り組んだ社会問題は外出中のペットの健康です。
コロナ禍でペットを飼い始めた人が、今では外出自粛も終わりペットを家に残して出社しているという現状があり、何かあった時に対応できない問題があります。
その問題を解決するのがBreetです。
Breetはペットの健康状態を外出先で確認できて空調管理や餌やりをスマホから行えます。
特に力を入れたところは餌やり機とwebアプリの連動です。餌やり機からデータを取得し、スマホから操作することができます。",,,
