name,catch_copy,lead,description,works_url,movie_url,system_diagram_url
DPB,あなたのドッグライフを更に楽しませる投稿サイト。,ゲーム感覚で芸を覚えさせる事もできます。犬のアバターを作り実際に芸をする所を撮って送信すればアバターをレベルアップさせる事ができます。,写真投稿と育成ゲームを組み合わせたサイトで、Miiの様に簡単にパーツを選んでいって自分の犬のアバターを作れます。実際にフリスビーキャッチや輪潜りができている所を撮影して、動画を送信すれば、レベルアップに必要なポイントを溜まります。最大まで溜めるとレベルアップしてアバターを大きくしたり称号をもらう事ができます。決められたレベルまで上げると、ドッグフードや投稿写真がプリントされたTシャツ等がもらえます。投稿のいいねを稼ぐとアバターに使えるリボン、サングラス等の着せ替えアイテムがもらえます。アイテムはフォローしているユーザー同士で交換する事も可能です。また、犬が飼えない人もサブターゲットとしており、画面内で飼えるのは勿論、飼ってなくても参加できるイベントの案内通知を受け取る事ができます。,,,
湯にてぃ〜,スーパー銭湯好きの為のスーパー銭湯アプリ,各スーパー銭湯がアプリ展開しているがバラバラで不便  そういった問題を解決する為と他にも不便な点を改善したアプリ,昨今サウナブームなどにより流行になりつつあるスーパー銭湯 アプリ展開はしているが、各スーパー銭湯で一つ一つアプリがあってユーザーは不便  そういった問題を改善する為に各スーパー銭湯のアプリを1つにし混雑状況やポイントカード クーポン機能なども共通にしたアプリ   テーマである繰り返し使える点においてもスタンプラリー  ランキング制度を導入し銭湯好きならぜひインストールしたいアプリ,,,
Chamedpalecs　webサイト,今宵、あなたを魔法の館のお茶会にご招待します,今宵、貴方は魔女に選ばれし特別なお客様、そんな貴方に最高のおもてなしを。「Chamedpalecs」で、魔法の世界を存分にお楽しみください。,"ゴスロリコンセプトのカフェ「Chamedpalecs」へようこそ。ここでは、お客様に非現実的な空間を提供します。
このお店は、非現実的な世界観に入り込んでもらうという楽しみ方です。お客様に有料で衣装の貸し出しも行なっており、ゴスロリを始めたばかりの人でもお楽しみいただけます。
カフェの利用だけでなく小物雑貨なども売っていて買い物の利用だけも可能です。
メニューの一番のこだわりはアフタヌーンティーです。
完全予約制ですが、世界観に入りやすく心を奪われるような体験になるでしょう。",,,
Penny Porter　(ペニーポーター),100均の即日配達サービスで、時間を節約しませんか？,どうしても「忙しい」「しんどい」などの理由で、外に出れない日に100均即日サービスを利用し、欲しい100均商品を即日お届けします。,"このアプリは今すぐ100均の商品が欲しい！(洗剤など) だけど「しんどい」「忙しい」などの理由で買いに行けない時にこのサービスを利用してもらいます。このサービスの特徴は100均商品を即日配達し、100均の各店舗の商品を比べて購入する事ができ、足を運ばなくても購入できます。
繰り返しサービスを利用してもらうには、ライフハック技術を毎週配信します。
【運営】のライフハック術と【ユーザー】が自由に配信できるライフハック術の両方を掲載することで作成意欲を促し、購入に繋げます。

力を入れた点は、100均なのでどの世代でもフィットするように、シンプルで見やすいレイアウトを意識しました。",,,
まにまる,お金を食べて進化する！動物育成の貯金アプリ,"動物育成と貯金をかけあわせたアプリです。
お金(課金)でえさを買って、アプリ内の動物に食べさせてあげることで貯金ができて、大きくなっていきます。","貯金アプリに動物育成の要素を混ぜた育成貯金アプリです。
お金(課金)でえさを購入して、育成中の動物に食べさせることで成長していき、貯金ができるという内容です。アプリ内の動物たちはただ大きくなるだけではなく、食べたえさによって見た目が変化するという性質を持っています。最初に目標として貯める金額を設定するのですが、目標金額を達成するとクーポンがもらえたりアプリ内で使用できるアイテムがもらえます。さらに目標金額を達成した動物は自分だけの動物園をつくることができるので、コレクションすることができます。主に男子学生に向けたアプリで、若い世代の貯金を楽しく手助けします。",,,
SeeK,スポーツをしたい人がフォーム入力で簡単マッチング！,"操作簡単でスポーツをしたい人同士を繋げるこれまでにないマッチングアプリ！
ランク制度があり、スポーツするたびにランクが上がる！
","コロナも終息していき、みんなスポーツをするようになりましたが、スポーツをしたくても一緒にスポーツをする人がいない人のためにスポーツをしたい人同士をマッチングさせるアプリです。
ターゲットはスポーツをしたい20代大学生。
ランク制度が４段階ありスポーツをするたびにptがもらえ、ランクが上がっていく仕組みです。
アプリ内で施設予約が可能でランクによって施設代が安くなる仕様です！
配色は深い青と無彩色を使っていて、友好的な意味と統一感を出していて、フォントはシンプルなフォントで目立たせずにロゴだけが目立つようにしています！
写真を使わずアイコンだけで作っており見やすさアップ！",,,
illuStory（イラストーリー）,イラストの制作過程と物語性を様々な角度から楽しむ。,イラストができるまでの過程に物語性をもたせることで、メイキングを動画として公開することができます。それによりで画力以外にも表現方法が生まれます。,"静止画のイメージや、近年はSNSで一瞬しか見ない機会の多いイラストですが、物語性のあるイラストを描き、様々な角度から楽しんで頂き、イラストから新たな発見をするサービスです。
ターゲットは、イラストに新鮮さを感じたい方や、イラストや想像を画力以外でも表現したい方です。
機能は、描いた内容をクラウド上に記録し保存することができます。
関連動画をいいね数に関係なく、タグに関連した動画を表示することや、いいねの非表示表示を、純粋に作品を楽しむことができます。そうすることで投稿を始めた方でも、評価される機会があります。

このサービスを利用することによりクリエイティブなコンテンツが循環します。",,,
fashionable,今日のナンバーワンコーデを提案するサイト,自分の服を設定し、毎日のファッションが困らなくなるWebサイト,"自分が今持っている服の特徴を選択してそれに合う服を提案しするサイトです。
ターゲットはファッションに興味はあるが、色の組み合わせなどのファッションが苦手な若い層にしました。
他のファッションサイトにはない点の「提案する」という強みを活かして普段ファッションサイトを利用している層はもちろん、あまり利用していない層までが利用できるサイトになっています。",,,
daily me,オシャレする「毎日の自分」を共有しよう,"おしゃれに興味のあるあなたを見つけてもらえる場所、それがdailyme。
自分のコーデを投稿しファッションリーダーを目指せ。","ファッションに興味のある人が毎日の自分のコーデを投稿するスマホアプリ。
１日１回投稿しないと他の人の投稿が見ることができないが、投稿するとたくさんの系統のコーデやお気に入りの投稿にスタンプを押したり気になるユーザーをフォローすることもできる。
自分の投稿がたまっていくと、コーデのカラーを集計して自分のよく使う「MY COLOR」がどんどん更新されて自分のおしゃれ磨きにも繋がる。
連続投稿や継続投稿でポイントがたまって、連携する通販サイトで使えるお得なクーポンをもらえたり、投稿に集まったスタンプ数でランキング上位に入ると、ファッション雑誌の特集にお呼ばれされちゃうかも！",,,
DESC,コンペを体感して、デザイン力を向上させるサブスクアプリ,コンペで自分も参加できる＋プロのデザイナーのコンペ作品を閲覧でき、その作品は自分の教科書になり、流行りのデザインを勉強できます！,"コンペティションと各ミッションを通してデザインの勉強ができるPCアプリです。
メインターゲットは、デザイン関係の学生で、サブターゲットはプロのデザイナーです。
アプリのウリは、毎日更新されるコンペティションとデイリーミッションです。コンペティションが更新されることにより、プロのデザインを多く見ることができます。デイリーミッションは、完了するとカレンダー部分に色が付き、継続力を『見える化』してくれモチベーションアップに繋がります。
力を入れた部分は、アプリの画面デザインで2023年の流行りの『70s Retro Flat Design』と『The 3D Memphis Style』を掛け合わせ流行りのデザインにしました。",,,
すくすくREC,アルバムで思い出や健康を管理できる成長日記,アルバムを自由にカスタマイズ出来て、年齢だけでなく寝顔、散歩、運動会などカテゴリー別で分ける事ができ思い出をいつでも見返す事ができます。,子どもの成長や健康を思い出として記録に残せるアプリです。ターゲットは20代30代のご家族で、特にアルバムの機能が強みや力を入れた部分でお子さんとお出かけして写真を撮るだけじゃその時の出来事は記憶に残ると思うんですけど、日にちが経つにつれて思い出すのが難しいため記憶だけじゃなくアルバムを自由に作成することでより具体的に記録できて忘れた時でもアルバムを見ればいつでもお子さんとの思い出を見返す事ができます。健康管理はカレンダー機能で一括で出来るようになっていてお子さんの身長や体重やその日の簡単な出来事など、カレンダー機能にも親御さんが見て思い出せるように可視化できて見やすくわかりやすくなっています。,,,
Tanuki Cafe Online,繁忙な日常からひとときの癒しへ。至福のカフェタイムをお届けします！！,忙しい毎日を忘れ、優雅なカフェの世界へ。美味と温もりに包まれる贅沢なひとときをお楽しみください。メニューやイベントの詳細をお伝えいたします。,"私のカフェは、この忙しい世の中で可愛いとリラックスを求める人々に向けて特別な場所を提供しています。このお店では、至福のカフェ体験を追求し、美味しい飲み物や心地よい雰囲気の提供を目標としています。
グラフィックデザインは私の得意分野ではないので、グラフィック物を作るために多くの労力を費やしました。
ウェブサイトを作るにあたって、私は実際のカフェで使用されているウェブサイトを参考にしました。そして直感的なウェブサイトを作るために最善の努力を尽くしました。特に、ナビゲーションバーやフレックスボックスのデザインに多くの時間がかかりました。
私はエンジニアを目指しています。
このプロジェクトで、プログラミングのスキル向上だけではなく、グラフィックデザインのスキルも向上させることができ、私は沢山のことを学びました。",,,
Relax coffee,初めてでも安心。コーヒーの楽しみ方を学びましょう！,初心者でも安心。コーヒーの魅力や楽しみ方を丁寧にお伝えします。豆選びから淹れ方まで、一緒に１から学びましょう！,コーヒーを初めてみたい人やコーヒーの淹れ方に興味のある人をターゲットにした、実践的なコーヒー教室と販売を提供しています。お店に足を運んでいただき、一緒に淹れ方を楽しみながら学んでいただけます。さらに、コーヒー豆や機材の販売も行っており、お店の中で必要なものを揃えることができます。お客様は好みの豆や機材を選ぶことができるため、利便性と選択の自由があります。私たちのお店は、自宅でも本格的なコーヒー体験を楽しむことができるため、お客様にとって特別な場所となっています。,,,
Rider’s　attraction,バイク好きな人が集まり会話ができるカフェで楽しい時間を。,ツーリングの休憩スポットや目的地として来店して頂き、ライダー同士でお店の手作りのご飯などを飲食しながらバイクの話をして頂けます。,ツーリングの休憩地点や目的地として来店して頂け、ライダーをターゲットにしています。本店のウリはインターネットやバイク雑誌での宣伝など、ネットの得意・不得意に関係なく情報を集めて頂き、様々な年齢層の方が情報を得て来店して頂きやすいという点です。また男性ライダーが多い中、女性店長が営んでいる事や甘いメニューもご用意している事により女性ライダーもご来店して頂きやすいようにしました。工夫ポイントはライダー同士の会話についてです。一つ目はどの種類のバイクに乗っているかが分かるステッカーをご用意し、会話のきっかけになるものを作り会話を始めて頂きやすいようにしました。二つ目は専用のアプリで自分の興味のある会話項目などを選択して頂き、話したい方を見つけアプリで声をかけてからお互いが承認し、その場で合流して頂けるようにした事の二点です。,,,
猫の散歩道,猫と気ままに癒され生活 今日はどこへお散歩に行く？,"自分の好きな猫と遊んだりご飯をあげて仲良くなると、日本中の観光地を一緒に散歩して巡ることができ、旅行気分を味わえる
","猫と遊んで仲良くなり一緒に日本中を散歩することで、いろんな街の素敵な場所に出会えるサービス。
自由気ままに散歩をする猫達は、有名な観光スポットからあまり知られていない隠れスポットにも散歩しに行くことがあります。猫と一緒に新しい場所を見つけてお気に入りの場所ができるかも。忙しいスケジュールの中で旅行に行くことが難しい人にとっては旅行気分を味わうことができ、旅行によく行く人にとっては新しい旅先を見つけるのにも最適です。
ぜひあなただけのお気に入りスポットを猫と一緒に見つけてみては。",,,
ふらわーほーめ,「より良い休日を！」,"より良い休日を！お花に囲まれて贅沢な休日にしませんか？
お花の紅茶を楽しむために！ゆっくり読書を楽しむために！
さまざまな利用方法があります！
","お花をコンセプトにカフェを作りました。
このカフェはお花が好きな人にむけての部屋があり、沢山のお花に囲まれて過ごせる居心地のいい空間になっています。
お花を眺めながら食事や読書をすることで、心を癒しリラックスすることができます。
デザインで力を入れたところは、サイトのトップページのメインビジュアルです。
お花が飾られている家をイメージして作りました。
サイトを開いた時に見える家の中は、心の癒しを与える花々で囲まれた暖かい家の雰囲気を表しています。",,,
Dolores,18世紀のヨーロッパを21世紀に日本で楽しめるように。,忙しい日常の中で、普段は試してみない服を着て、お茶を飲んで、ゆったりとした自分自身を完全に楽しめる時間を持つことが時々難しい。,普通の日常で、ヨーロッパ旅行に来たような気持ちをしばらくでも楽しめるように、コンセプトに最大限に没入してご用意しました。 単にカフェでお茶を楽しむだけじゃなく、ドレス、靴、髪飾りなどをレンタルして写真を撮ることができるフォトゾーンを作りたいと思いました。デザイン物のほとんどを名画の絵を使って美術館のような感じも出したいと思いました。 使用したチケットは保管して思い出できるように主なデザインを左に配置したし、メニューパネルも現代的な感じを排除するために紙のテクスチャの背景を使いました。,,,
Ride On Cafe,最高の食事を、最高の愛車と共に,全てのバイクが好きな人のためのこれまでにない斬新なカフェ。ドライブインシアターからインスピレーションを得ました。,世の中に多く存在するライダーズカフェとは一風変わったライダーズカフェをイメージして制作しました。「愛車にずっと乗っていたい」「もっと多くの人に自分の愛車を見て欲しい」、多くのライダーが持つ願いを叶えられるカフェになるよう工夫しました。どのようなカフェにすればライダーに喜ばれるのか、同じライダーとして考え制作したので、ライダーに喜ばれるような要素を多く取り込んだカフェになっているかと思います。,,,
サウナカフェ「サウナタウコ」,北欧のサウナ文化、コーヒー文化をコラボレーション。,サウナで整った体のまま、カフェでゆったりリラックス。カフェスペースでは、サウナ好き同士の社交の場として開放的な空間を提供します。,"このカフェは現代社会を生きるサラリーマンをターゲットとし、疲れを癒すとともに、サウナが好きな人と人とを繋ぐ交流の場を提供します。
一つの建物内で、シームレスにサウナからカフェへ移行できることにより、サウナ後の倦怠感をゆったりとカフェスぺースでやわらげ、リラックスすることできます。サウナとカフェの要素だけでなく、交流の場とすることで、そこにコミュニティを形成し、また2回目も行きたいと思ってもらえることを狙っています。",,,
高校野球カフェ『18.44』,根っからの野球好き、野球バカが集まるお店,"高校野球の魅力が溢れる、空間へようこそ！
高校野球カフェ『18.44』で明るいプレーと感動の瞬間を味わいながら、みんなと一緒に盛り上がりませんか？
ここにしかない高校野球の楽しみを感じてみてください！","高校野球カフェ『18.44』は高校野球の魅力と感動をテーマにした、独自のコンセプトを持つカフェです。まず店内には、壁一面に全国の強豪校から古豪まで多数のユニホームが飾られております。そしてそのユニホームの全てが着用可能になっており、憧れの高校の一員になる事ができます。
他にも有名選手のサインボールなどが飾られております。メニューにも独自のアイデアが凝らされています。例えば「ホームランシェイク」と言う名の特製スムージーがあり、フレッシュなフルーツとエネルギーを補給できる一杯となっています。さらにカフェ内では定期的にイベントが開催されており、そこで野球好きの方たちと親交を深めることも可能です。そしてこのカフェでは地域の寮生がいる高校と食事提携を行っています。
食事の面から地域の高校をサポートする活動も行っています。タイミングが良ければ有名な選手に会えるかも？『18.44』は高校野球ファンにとって仲間とともに盛り上がり素晴らしい時間を過ごせる場所になっています。ぜひ一度高校野球カフェ『18.44』を訪れてみてください。",,,
スターリンク,行きやすいから行きたくなる店になります。,この店を来てくれるお客様に最大な満足を与えます。,静かにやりたいことをやりながら過ごしたい、学生向き、宇宙についての教育とかを共有するサイトです。,,,
Hobby Links,「好き」をシェアしよう!,好きなことや趣味、マニアックで近くの人で共有できないようなことを誰かと共有して、プライベートを充実させましょう。,同じ趣味興味や趣味を持つ人々のための、対面およびオンラインの活動、イベントを主催および組織するためのプラットフォームです。対面およびオンラインの活動やイベントを主催し、参加者同士の交流をサポートします。興味の合う仲間との出会いや情報共有、新たな体験の発見を促進します。ユーザーフレンドリーなインターフェースと高度なマッチングシステムにより、最適なイベントや活動に参加できます。趣味を通じたつながりを深め、豊かな人生を楽しみましょう。趣味コネクトで新たな世界が広がります！趣味、イベントとも書いてありますが、組織的な考え方も可能で、部署というグループでプロジェクトというイベントを作成し共有、参加、人員の収集などすることもできる。,,,
Hydro Mate,海と財布と学生の味方！！,近年、ペットボトルのポイ捨ての影響で海に流れてマイクロプラスチックになるという問題があります。この問題を解決する為にマイボトルに目をつけました。マイボトルを使用した自販機を作ることによりペットボトルの消費量が減少すると考えました。また料金を学費に加えることにより使えば使うほど安くなり財布に優しいです。,"私たちは、【マイボトルの利用者を増やしペットボトルの消費量削減をする】をテーマに学生向きのHaidari mateというウォーターサーバを作成しました。
使用方法は、あらかじめ学生に契約をしてもらい学生書のNFCのIDをデータベースに登録する。登録されたNFCをカードリーダーにかざすとデータベースを参照し、Haidari mateが使用できるようになります。マイボトルをセットしサイズに合わせたボタンを押すと給水が開始されます。
特に力を入れたのは組み込み系の技術です。今回始めて組み込み系に挑戦しました。ボタン押すと水を吸い上げる処理や骨組みや塗装を一からやりました。",,,
